{
    "hello": "Hola {0}",
    "productPrice": "El precio de {0} es {1} {2}",
    "noParams": "Esta cadena no necesita parametros",
    "forgotPassword": "Olvide mi contraseña",
    "rememberMe": "Recordarme",
    "signIn": "Iniciar Sesion",
    "password": "Contraseña",
    "username": "Usuario"
}
